{
    "level_id": "target_group_tasks",
    "display_name": "Target Group Tasks",
    "objective": {
        "id": "obj_target_group",
        "title": "Target Group Tasks",
        "stages": [
            {
                "id": "stage_intro",
                "completion_mode": "ALL_REQUIRED",
                "location_spawns": [
                    {
                        "id": "Ancient Cave",
                        "location_name": "Ancient Cave",
                        "coord": {
                            "x": 3,
                            "y": 2
                        },
                        "willpower": 3,
                        "location_scene_path": "res://Gameplay/scene_templates/location.tscn"
                    },
                    {
                        "id": "Sunken Vault",
                        "location_name": "Sunken Vault",
                        "coord": {
                            "x": 4,
                            "y": 3
                        },
                        "willpower": 3,
                        "location_scene_path": "res://Gameplay/scene_templates/location.tscn"
                    }
                ],
                "enemy_spawns": [
                    {
                        "unit_scene_path": "res://Gameplay/scene_templates/generic_enemy.tscn",
                        "unit_name": "Beast Alpha",
                        "coord": {
                            "x": 5,
                            "y": 2
                        },
                        "faction": "ENEMY"
                    }
                ],
                "loot_spawns": [
                    {
                        "items": [
                            "res://Resources/items/bronze_clarity.tres"
                        ],
                        "coord": {
                            "x": 2,
                            "y": 2
                        },
                        "id": "Relic Cache"
                    }
                ],
                "tasks": [
                    {
                        "id": "task_collect_relics",
                        "title": "Secure the Relics",
                        "description": "Collect relics from either ruin to satisfy the historians.",
                        "target_filters": [
                            {
                                "event_type": "explore",
                                "target_id": "Ancient Cave",
                                "target_kind": "location"
                            },
                            {
                                "event_type": "explore",
                                "target_id": "Sunken Vault",
                                "target_kind": "location"
                            },
                            {
                                "event_type": "loot",
                                "target_id": "Relic Cache",
                                "target_kind": "item"
                            }
                        ],
                        "effort_required": 3,
                        "is_optional": false
                    },
                    {
                        "id": "task_resolve_beast",
                        "title": "Resolve the Alpha",
                        "description": "Either convince or defeat the Beast Alpha to calm the woods.",
                        "target_kind": "unit",
                        "target_filters": [
                            {
                                "event_type": "convince",
                                "target_id": "Beast Alpha",
                                "target_kind": "unit"
                            },
                            {
                                "event_type": "eliminate",
                                "target_id": "Beast Alpha",
                                "target_kind": "unit"
                            }
                        ],
                        "effort_required": 1,
                        "is_optional": false
                    }
                ],
                "default_next_stage_id": "stage_cleanup"
            },
            {
                "id": "stage_cleanup",
                "tasks": [],
                "completion_mode": "ALL_REQUIRED"
            }
        ]
    },
    "terrain": {
        "grid_width": 7,
        "grid_height": 5,
        "rows": [
            "GGGGGGG",
            "GGGGGGG",
            "GGGGGGG",
            "GGGGGGG",
            "GGGGGGG"
        ]
    },
    "player_starts": [
        {
            "x": 1,
            "y": 2
        },
        {
            "x": 1,
            "y": 3
        }
    ]
}