{
  "level_id": "tutorial_03",
  "display_name": "The Sinking Cache",
  "starting_weather": "gusto",
  "terrain": {
    "grid_width": 7,
    "grid_height": 5,
    "rows": [
      "GGGMGGG",
      "GGGMGGG",
      "GGGGGGG",
      "GGGMGGG",
      "GGGMGGG"
    ]
  },
  "player_starts": [
    {
      "x": 0,
      "y": 2,
      "unit_scene_path": "res://Resources/characters/core/monk.tscn",
      "faction": "PLAYER"
    }
  ],
  "objective": {
    "id": "tutorial_objective",
    "title": "Tutorial Goal",
    "stages": [
      {
        "id": "stage_1",
        "tasks": [
          {
            "id": "task_tutorial_03",
            "title": "Gather Hidden Cache",
            "description": "The swamp is deep and clinging. Push through the mud to recover the hidden supplies.",
            "event_type": "gather",
            "target_kind": "loot",
            "target_id": "HiddenCache"
          }
        ],
        "enemy_spawns": [],
        "neutral_spawns": [],
        "location_spawns": [],
        "loot_spawns": [
          {
            "id": "HiddenCache",
            "coord": {
              "x": 6,
              "y": 2
            },
            "items": [
              "res://Resources/items/bronze_gusto.tres"
            ]
          }
        ],
        "dialogue_journal_entries": [],
        "on_enter": [
          "lore_tutorial_03"
        ]
      }
    ]
  },
  "dialogue_journal_entries": [
    {
      "entry_id": "lore_tutorial_03",
      "title": "The Sinking Cache",
      "notes": "The swamp clings to the weak, but my resolve is iron. I find strength in the struggle.",
      "section_id": "tutorial_03",
      "topic_id": "stage_1"
    }
  ]
}