{
  "level_id": "tutorial_05",
  "display_name": "The Outpost",
  "starting_weather": "grit",
  "terrain": {
    "grid_width": 7,
    "grid_height": 5,
    "rows": [
      "GGGFGGG",
      "GGGFGGG",
      "GGGGGGG",
      "GGGFGGG",
      "GGGFGGG"
    ]
  },
  "player_starts": [
    {
      "x": 0,
      "y": 2,
      "unit_scene_path": "res://Resources/characters/core/berserker.tscn",
      "faction": "PLAYER"
    }
  ],
  "objective": {
    "id": "tutorial_objective",
    "title": "Tutorial Goal",
    "stages": [
      {
        "id": "stage_1",
        "tasks": [
          {
            "id": "task_tutorial_05",
            "title": "Eliminate Bandit Leader",
            "description": "A bandit has taken over this fort. Break through their defenses and deliver your message.",
            "event_type": "eliminate",
            "target_kind": "unit",
            "target_id": "BanditLeader"
          }
        ],
        "enemy_spawns": [
          {
            "id": "BanditLeader",
            "unit_name": "Bandit Leader",
            "faction": "ENEMY",
            "coord": {
              "x": 6,
              "y": 2
            },
            "willpower": 5
          }
        ],
        "neutral_spawns": [],
        "location_spawns": [],
        "loot_spawns": [],
        "dialogue_journal_entries": [],
        "on_enter": [
          "lore_tutorial_05"
        ]
      }
    ]
  },
  "dialogue_journal_entries": [
    {
      "entry_id": "lore_tutorial_05",
      "title": "The Outpost",
      "notes": "Stone walls will not stop my rage. Some messages are only delivered with steel.",
      "section_id": "tutorial_05",
      "topic_id": "stage_1"
    }
  ]
}