{
  "level_id": "tutorial_04",
  "display_name": "The Shadowed Ruins",
  "starting_weather": "shade",
  "terrain": {
    "grid_width": 7,
    "grid_height": 5,
    "rows": [
      "GGGNGGG",
      "GGGNGGG",
      "GGGGGGG",
      "GGGNGGG",
      "GGGNGGG"
    ]
  },
  "player_starts": [
    {
      "x": 0,
      "y": 2,
      "unit_scene_path": "res://Resources/characters/core/assassin.tscn",
      "faction": "PLAYER"
    }
  ],
  "objective": {
    "id": "tutorial_objective",
    "title": "Tutorial Goal",
    "stages": [
      {
        "id": "stage_1",
        "tasks": [
          {
            "id": "task_tutorial_04",
            "title": "Explore Haunted Pit",
            "description": "Spirits haunt these cold ruins. Move through the shadows to investigate the haunted pit.",
            "event_type": "explore",
            "target_kind": "location",
            "target_id": "HauntedPit"
          }
        ],
        "enemy_spawns": [],
        "neutral_spawns": [],
        "location_spawns": [
          {
            "id": "HauntedPit",
            "location_name": "Haunted Pit",
            "coord": {
              "x": 6,
              "y": 2
            },
            "hazard": true,
            "willpower": 5
          }
        ],
        "loot_spawns": [],
        "dialogue_journal_entries": [],
        "on_enter": [
          "lore_tutorial_04"
        ]
      }
    ]
  },
  "dialogue_journal_entries": [
    {
      "entry_id": "lore_tutorial_04",
      "title": "The Shadowed Ruins",
      "notes": "A shadow in the ruins is never truly alone. Old spirits guarded the stone, but I moved unseen.",
      "section_id": "tutorial_04",
      "topic_id": "stage_1"
    }
  ]
}