{
  "level_id": "tutorial_01",
  "display_name": "The Gatekeeper",
  "starting_weather": "shine",
  "terrain": {
    "grid_width": 7,
    "grid_height": 5,
    "rows": [
      "GGG6GGG",
      "GGG6GGG",
      "GGGGGGG",
      "GGG6GGG",
      "GGG6GGG"
    ]
  },
  "player_starts": [
    {
      "x": 0,
      "y": 2,
      "unit_scene_path": "res://Resources/characters/core/healer.tscn",
      "faction": "PLAYER"
    }
  ],
  "objective": {
    "id": "tutorial_objective",
    "title": "Tutorial Goal",
    "stages": [
      {
        "id": "stage_1",
        "tasks": [
          {
            "id": "task_tutorial_01",
            "title": "Convince Gate Guard",
            "description": "The sacred monastery is blocked by a firm guard. Use your presence to convince them to let you pass.",
            "event_type": "convince",
            "target_kind": "unit",
            "target_id": "GateGuard"
          }
        ],
        "enemy_spawns": [],
        "neutral_spawns": [
          {
            "id": "GateGuard",
            "unit_name": "Gate Guard",
            "faction": "NEUTRAL",
            "coord": {
              "x": 6,
              "y": 2
            },
            "willpower": 1
          }
        ],
        "location_spawns": [],
        "loot_spawns": [],
        "dialogue_journal_entries": [],
        "on_enter": [
          "lore_tutorial_01"
        ]
      }
    ]
  },
  "dialogue_journal_entries": [
    {
      "entry_id": "lore_tutorial_01",
      "title": "The Gatekeeper",
      "notes": "Sacred ground offers solace, but the gatekeeper is firm. I spoke my way through the first blockade.",
      "section_id": "tutorial_01",
      "topic_id": "stage_1"
    }
  ]
}